Sentence,Label
"Phosphorylated Cln1 was MODIFIED by [E]PROTEIN[/E] complexes containing the F-box protein Grr1, Rbx1, and the TRANSFERASE Cdc34",0
"Phosphorylated Cln1 was MODIFIED by SCF (Skp1-Cdc53-F-box protein) complexes containing the F-box protein Grr1, Rbx1, and the [E]PROTEIN[/E]",0
"Phosphorylated Cln1 was MODIFIED by SCF (Skp1-Cdc53-F-box protein) complexes containing the F-box protein Grr1, [E]PROTEIN[/E], and the TRANSFERASE Cdc34",0
"In vitro, E2F1 can be MODIFIED by [E]PROTEIN[/E] but not by TRANSFERASE/CDC34, is dependent on catalytically active ROC1, and is protected by the Rb protein",0
"In vitro, E2F1 can be MODIFIED by TRANSFERASE/Ubc5 but not by [E]PROTEIN[/E], is dependent on catalytically active ROC1, and is protected by the Rb protein",0
"In vitro, E2F1 can be MODIFIED by TRANSFERASE/Ubc5 but not by TRANSFERASE/CDC34, is dependent on catalytically active ROC1, and is protected by the [E]PROTEIN[/E]",0
"In vitro, E2F1 can be MODIFIED by TRANSFERASE/Ubc5 but not by TRANSFERASE/CDC34, is dependent on catalytically active [E]PROTEIN[/E], and is protected by the Rb protein",0
"The activation of wild-type PKClambda by serum stimulation of cells enhances the MODIFICATION of the protein, supporting the notion that active PKClambda is preferentially MODIFIED by [E]PROTEIN[/E] TRANSFERASE",0
"Although c-IAP1 bound TRAF2 and TRAF1 in vitro, [E]PROTEIN[/E] MODIFIED only TRAF2",0
"Although [E]PROTEIN[/E] bound TRAF2 and TRAF1 in vitro, it MODIFIED only TRAF2",0
IFNAR1 is MODIFIED by the [E]PROTEIN[/E] TRANSFERASE in vitro,0
Rho-GTP stimulates the kinase activity of full-length MEKK1 as much as 10-fold toward MEK4 but does not appear to be MODIFIED by [E]PROTEIN[/E] under conditions that result in modification of ERK2,0
PSD-95 interacts with and is MODIFIED by the [E]PROTEIN[/E],0
[E]PROTEIN[/E] MODIFIED PCAF in vitro and in cells,0
"Both the Pr and the Pfr forms of phyA, as well as the PHYA apoprotein, are MODIFIED by [E]PROTEIN[/E] in vitro",0
"[E]PROTEIN[/E]/BARD1 MODIFIED lysines 48 and 344 of gamma-tubulin in vitro, and expression in cells of gamma-tubulin K48R caused a marked amplification of centrosomes",0
"BRCA1/[E]PROTEIN[/E] MODIFIED lysines 48 and 344 of gamma-tubulin in vitro, and expression in cells of gamma-tubulin K48R caused a marked amplification of centrosomes",0
"Results showed that centrosome components, including gamma-tubulin, are MODIFIED by BRCA1/[E]PROTEIN[/E] in vitro",0
Endoplasmic reticulum-associated degradation (ERAD) is a system in which unfolded proteins drained from the ER lumen to the cytosol are MODIFIED then degraded by [E]PROTEIN[/E],0
[E]PROTEIN[/E] MODIFIED and degraded Pael-R through its TRANSFERASE activity,0
"Both HFR1 and HFR1(DeltaN) can be MODIFIED by [E]PROTEIN[/E], although with different efficiencies",0
"Taken together, our results show that HFR1 is MODIFIED by [E]PROTEIN[/E] TRANSFERASE and marked for post-translational degradation during photomorphogenesis.",0
Hypoxia-inducible factor (HIF)-1alpha is a short-lived protein and is MODIFIED and degraded through the [E]PROTEIN[/E]-TRANSFERASE pathway at normoxia,0
These findings suggest that MODIFICATION of HIF-1alpha is a dynamic process and that MODIFIED HIF-1alpha might be rescued from degradation by [E]PROTEIN[/E] through deMODIFICATION,0
Only the Ser-5 hyperphosphorylated form is MODIFIED by BRCA1/[E]PROTEIN[/E],0
Only the Ser-5 hyperphosphorylated form is MODIFIED by [E]PROTEIN[/E]/BARD1,0
"The relevance of these substrates was confirmed in vivo by showing that a number of them interact genetically with [E]PROTEIN[/E], and some were MODIFIED by Rsp5 in vivo",0
"The relevance of these substrates was confirmed in vivo by showing that a number of them interact genetically with Rsp5, and some were MODIFIED by [E]PROTEIN[/E] in vivo",0
"Overexpression of Hrs or a dominant-negative mutant of [E]PROTEIN[/E], proteins that play roles in the endosomal sorting of MODIFIED receptors, caused the accumulation of endogenous UBPY on exaggerated endosomes",0
"Overexpression of Hrs or a dominant-negative mutant of SKD1, proteins that play roles in the endosomal sorting of MODIFIED receptors, caused the accumulation of endogenous [E]PROTEIN[/E] on exaggerated endosomes",0
"Interestingly, a catalytically inactive UnpEL mutant was strongly MODIFIED by [E]PROTEIN[/E] in HEK293T cells",0
"These results suggest that wild-type UnpEL is MODIFIED by [E]PROTEIN[/E] and deMODIFIED by itself (self-deMODIFICATION), while mutant UnpEL is MODIFIED by Ro52 but not deMODIFIED by itself",0
"These results suggest that wild-type UnpEL is MODIFIED by Ro52 and deMODIFIED by itself (self-deMODIFICATION), while mutant UnpEL is MODIFIED by [E]PROTEIN[/E] but not deMODIFIED by itself",0
We also showed that UnpEL is MODIFIED by [E]PROTEIN[/E] in HEK293T cells,0
"Here, we showed that UnpEL is MODIFIED by [E]PROTEIN[/E] in cooperation with UbcH5B in vitro",0
"Here, we showed that UnpEL is MODIFIED by Ro52 in cooperation with [E]PROTEIN[/E] in vitro",0
UnpEL/Usp4 is MODIFIED by [E]PROTEIN[/E] and deMODIFIED by itself,0
"Notably, a mutant form of NEMO that cannot be MODIFIED inhibited [E]PROTEIN[/E]-induced NF-kappaB activation",0
We further show that L11 inhibited [E]PROTEIN[/E]-mediated degradation of MODIFIED MDM2 in vitro and consistently prolonged the half-life of MDM2 in cells,0
We further show that [E]PROTEIN[/E] inhibited 26 S proteasome-mediated degradation of MODIFIED MDM2 in vitro and consistently prolonged the half-life of MDM2 in cells,0
"These results suggest that L11, unlike L5 and L23, differentially regulates the levels of MODIFIED p53 and [E]PROTEIN[/E] and inhibits the turnover and activity of MDM2 through a post-MODIFICATION mechanism.",0
"We propose that by MODIFYING Eps15, parkin interferes with the ability of the [E]PROTEIN[/E] to bind MODIFIED EGFR, thereby delaying EGFR internalization and degradation, and promoting PI(3)K-Akt signalling",0
"We propose that by MODIFYING Eps15, parkin interferes with the ability of the Eps15 UIMs to bind MODIFIED EGFR, thereby delaying EGFR internalization and degradation, and promoting [E]PROTEIN[/E]",0
"We propose that by MODIFYING Eps15, parkin interferes with the ability of the Eps15 UIMs to bind MODIFIED EGFR, thereby delaying [E]PROTEIN[/E] internalization and degradation, and promoting PI(3)K-Akt signalling",0
"Furthermore, in vitro MODIFICATION assay also demonstrates that TH1 can be MODIFIED by [E]PROTEIN[/E]",0
"[E]PROTEIN[/E]-detectable MODIFIED p53 was easily purified from the insect cell-free protein synthesis system, allowing analysis of the GROUP-conjugated proteins by mass spectrometry (MS)",0
"Similar, siRNA knockdown of E6-AP and the TRANSFERASE Ubc9 increased cellular SOX9 amounts, supporting the notion that SOX9 may be MODIFIED in hypertrophic chondrocytes by [E]PROTEIN[/E] and degraded by proteasomes",0
"Moreover, our data indicated that BLM was MODIFIED by [E]PROTEIN[/E] and degraded in G1 cells but was stabilized by TopBP1 in S phase cells",0
"Moreover, our data indicated that BLM was MODIFIED by TRANSFERASE [E]PROTEIN[/E] and degraded in G1 cells but was stabilized by TopBP1 in S phase cells",0
Results of experiments using antibodies against [E]PROTEIN[/E] and GROUP indicate that Cbf2p is MODIFIED in vivo,0
"SIC1 is MODIFIED in vitro by a pathway that requires CDC4, CDC34, and [E]PROTEIN[/E] activities",0
"SIC1 is MODIFIED in vitro by a pathway that requires CDC4, [E]PROTEIN[/E], and cyclin/CDK activities",0
"SIC1 is MODIFIED in vitro by a pathway that requires [E]PROTEIN[/E], CDC34, and cyclin/CDK activities",0
"Moreover, purified phosphoSic1p was MODIFIED in [E]PROTEIN[/E], indicating that a primary function of G1 cyclins is to tag Sic1p for destruction",0
"Moreover, purified phosphoSic1p was MODIFIED in cyclin-depleted G1 extract, indicating that a primary function of [E]PROTEIN[/E] is to tag Sic1p for destruction",0
"Moreover, purified phosphoSic1p was MODIFIED in cyclin-depleted G1 extract, indicating that a primary function of G1 cyclins is to tag [E]PROTEIN[/E] for destruction",0
"In addition, highly MODIFIED forms of E6-AP cannot bind to p53 in the presence of the [E]PROTEIN[/E] and, conversely, binding of E6-AP to p53 interferes with MODIFICATION of E6-AP",0
"In addition, highly MODIFIED forms of E6-AP cannot bind to [E]PROTEIN[/E] in the presence of the E6 oncoprotein and, conversely, binding of E6-AP to p53 interferes with MODIFICATION of E6-AP",0
Fusion of the [E]PROTEIN[/E] domain to another protein also causes that protein to be MODIFIED by Rsp5,0
Fusion of the Rpb1 carboxyl-terminal domain to [E]PROTEIN[/E] also causes that protein to be MODIFIED by Rsp5,0
"Cbl, in turn, binds and MODIFIES activated HGF receptor, and by recruiting the endophilin-[E]PROTEIN[/E] complex, it regulates receptor internalization",0
"A human WW domain-containing hect (WW-hect) TRANSFERASE protein closely related to [E]PROTEIN[/E], Rpf1/hNedd4, also binds and MODIFIES both yeast and human Rpb1 in vitro, suggesting that Rpf1 and/or another WW-TRANSFERASE protein mediates UV-induced degradation of the large subunit of polymerase II in human cells.",0
"A human WW domain-containing hect (WW-hect) TRANSFERASE protein closely related to Rsp5, Rpf1/[E]PROTEIN[/E], also binds and MODIFIES both yeast and human Rpb1 in vitro, suggesting that Rpf1 and/or another WW-TRANSFERASE protein mediates UV-induced degradation of the large subunit of polymerase II in human cells.",0
"A human WW domain-containing hect (WW-hect) TRANSFERASE protein closely related to Rsp5, [E]PROTEIN[/E]/hNedd4, also binds and MODIFIES both yeast and human Rpb1 in vitro, suggesting that Rpf1 and/or another WW-TRANSFERASE protein mediates UV-induced degradation of the large subunit of polymerase II in human cells.",0
"We have previously shown that [E]PROTEIN[/E] binds and MODIFIES the largest subunit of RNA polymerase II, Rpb1, in vitro",0
The checkpoint protein [E]PROTEIN[/E] is a TRANSFERASE that MODIFIES Plk1 and inhibits Cdc2 at the G2 to M transition,0
Our results indicate that [E]PROTEIN[/E] MODIFIES N-glycosylated proteins that are translocated from the ER to the cytosol by the quality control mechanism.,0
CHIP-[E]PROTEIN[/E] complex MODIFIES phosphorylated tau and enhances cell survival,0
[E]PROTEIN[/E] selectively binds and MODIFIES p73 but not p53; this results in the rapid proteasome-dependent degradation of p73,0
"Surprisingly, in p53 wild-type cells, ARF-BP1 directly binds and MODIFIES p53, and inactivation of endogenous ARF-BP1 is crucial for [E]PROTEIN[/E]-mediated p53 stabilization",0
"Surprisingly, in p53 wild-type cells, ARF-BP1 directly binds and MODIFIES p53, and inactivation of endogenous [E]PROTEIN[/E] is crucial for ARF-mediated p53 stabilization",0
"AIP2 has a stronger binding affinity for the [E]PROTEIN[/E] of ABI3 than the A1 + B1 domain, but only MODIFIES the latter",0
"[E]PROTEIN[/E] has a stronger binding affinity for the B2 + B3 domain of ABI3 than the A1 + B1 domain, but only MODIFIES the latter",0
"AIP2 has a stronger binding affinity for the B2 + B3 domain of [E]PROTEIN[/E] than the A1 + B1 domain, but only MODIFIES the latter",0
Trim32 is a TRANSFERASE mutated in limb girdle muscular dystrophy type 2H that binds to skeletal muscle [E]PROTEIN[/E] and MODIFIES actin,0
[E]PROTEIN[/E] is a TRANSFERASE mutated in limb girdle muscular dystrophy type 2H that binds to skeletal muscle myosin and MODIFIES actin,0
"Here we show that the TRANSFERASE [E]PROTEIN[/E] MODIFIES Myc in vivo and in vitro, forming a lysine 63-linked GROUP chain",0
[E]PROTEIN[/E] MODIFIES and promotes the degradation of RanBP2,0
[E]PROTEIN[/E] MODIFIES its phosphorylation-dependent binding partner CtIP,0
"Interestingly, [E]PROTEIN[/E] also interacts with and MODIFIES unexpanded ataxin-1",0
"These results indicate that [E]PROTEIN[/E] MODIFIES N-linked glycoproteins, which are translocated from the endoplasmic reticulum to the cytosol by the quality control mechanism",0
[E]PROTEIN[/E] interacts with and MODIFIES WNK kinases,0
[E]PROTEIN[/E] MODIFIES RIP2 and mediates Nod2-induced signaling and protective effects in colitis,0
"[E]PROTEIN[/E] noncanonically MODIFIES SirT6 at K170, which stabilizes SirT6 and prevents SirT6 canonical MODIFICATION by other TRANSFERASES",0
We show that [E]PROTEIN[/E] MODIFIES SOX9 in vitro and in vivo and that SOX9 levels are enhanced after addition of the proteasome inhibitor bortezomib,0
Our data unambiguously demonstrate that [E]PROTEIN[/E] MODIFIES axin through Lys 29 (K29)-linked GROUP chains,0
We show here that [E]PROTEIN[/E] binds and MODIFIES the largest subunit of RNA polymerase II (Rpb1) in vitro,0
"Here we show that [E]PROTEIN[/E] functions as an TRANSFERASE MODIFYING both itself and the myb transcription activator LAF1, which is required for complete phyA responses",0
These results demonstrate that [E]PROTEIN[/E] regulates the stability of PCAF by MODIFYING and degrading this protein.,0
"Thus, the three functionally distinct modules of [E]PROTEIN[/E] work cooperatively to regulate Notch signaling by associating with, MODIFYING, and internalizing Delta.",0
These observations thus demonstrated that [E]PROTEIN[/E] functions in MODIFYING MyoD via a sequence found in transcriptional coactivators,0
"We propose that by MODIFYING Eps15, [E]PROTEIN[/E] interferes with the ability of the Eps15 UIMs to bind MODIFIED EGFR, thereby delaying EGFR internalization and degradation, and promoting PI(3)K-Akt signalling",0
"We found here that a phosphorylated IkappaBalpha immunoprecipitated (IP-pIkappaBalpha) from the crude extract of HeLa cells which had been treated with [E]PROTEIN[/E] caused a dramatic MODIFICATION of itself, termed autoMODIFICATION, when incubated with ATP, GROUP, and E1-activating and TRANSFERASE-conjugating enzymes",0
[E]PROTEIN[/E] also catalyzed MODIFICATION of an in vitro synthesized 35S-IkappaBalpha previously phosphorylated by IkappaB-kinase (IKK) which is referred to as transMODIFICATION,0
Reconstitution of G1 cyclin MODIFICATION with complexes containing [E]PROTEIN[/E] and Rbx1,0
Reconstitution of G1 cyclin MODIFICATION with complexes containing SCFGrr1 and [E]PROTEIN[/E],0
Identification of HHR23A as a substrate for [E]PROTEIN[/E]-mediated MODIFICATION,0
A complex containing [E]PROTEIN[/E] recruits Cdc34 to catalyse MODIFICATION of IkappaBalpha,0
A complex containing betaTrCP recruits [E]PROTEIN[/E] to catalyse MODIFICATION of IkappaBalpha,0
Signal induced phosphorylation of IkappaBalpha on [E]PROTEIN[/E] targets the protein for MODIFICATION on lysine 21 and 22,0
These results suggest that [E]PROTEIN[/E]-mediated MODIFICATION and degradation of Rpb1 are components of the response to DNA damage,0
"This is followed by tyrosine phosphorylation of [E]PROTEIN[/E] at a site flanking its RING finger, which enables receptor MODIFICATION and degradation",0
"This is followed by [E]PROTEIN[/E] phosphorylation of c-Cbl at a site flanking its RING finger, which enables receptor MODIFICATION and degradation",0
"Whereas all three members of the Cbl family can enhance MODIFICATION, two oncogenic Cbl variants, whose [E]PROTEIN[/E] fingers are defective and phosphorylation sites are missing, are unable to desensitize EGFR",0
"This is followed by tyrosine phosphorylation of c-Cbl at a site flanking its [E]PROTEIN[/E] finger, which enables receptor MODIFICATION and degradation",0
"Whereas all three members of the [E]PROTEIN[/E] family can enhance MODIFICATION, two oncogenic Cbl variants, whose RING fingers are defective and phosphorylation sites are missing, are unable to desensitize EGFR",0
"Whereas all three members of the Cbl family can enhance MODIFICATION, two oncogenic [E]PROTEIN[/E] variants, whose RING fingers are defective and phosphorylation sites are missing, are unable to desensitize EGFR",0
"Whereas all three members of the Cbl family can enhance MODIFICATION, two oncogenic Cbl variants, whose RING fingers are defective and phosphorylation sites are missing, are unable to desensitize [E]PROTEIN[/E]",0
"We find that p53 promotes [E]PROTEIN[/E]-mediated MODIFICATION and proteasomal degradation of the HIF-1alpha subunit of hypoxia-inducible factor 1 (HIF-1), a heterodimeric transcription factor that regulates cellular energy metabolism and angiogenesis in response to oxygen deprivation",0
"It is apparent, therefore, that [E]PROTEIN[/E] manifests an intrinsic capacity to mediate MODIFICATION",0
Replacement of the Mdm2 RING with that of another protein ([E]PROTEIN[/E]) reconstituted MODIFICATION and proteasomal degradation of Mdm2,0
Point mutations within the putative ubac domain of [E]PROTEIN[/E] abolished H1-specific MODIFICATION in vitro,0
We show here that the human homolog of the Drosophila Scribble (Vartul) (hScrib) tumor suppressor protein is also targeted for MODIFICATION by the [E]PROTEIN[/E] in vitro and that expression of E6 induces degradation of hScrib in vivo,0
"N-Terminally extended human [E]PROTEIN[/E] mediate the MODIFICATION of RING-finger proteins, ARA54 and RNF8",0
"MODIFICATION of wild-type ARA54 and RNF8, expressed in COS-7 cells, was also observed, and a proteasome inhibitor, [E]PROTEIN[/E], prevented the degradation of these wild-type proteins, but was much less effective in protecting the RING mutants",0
"MODIFICATION of wild-type ARA54 and RNF8, expressed in COS-7 cells, was also observed, and a proteasome inhibitor, MG132, prevented the degradation of these [E]PROTEIN[/E], but was much less effective in protecting the RING mutants",0
"MODIFICATION of wild-type ARA54 and RNF8, expressed in COS-7 cells, was also observed, and a proteasome inhibitor, MG132, prevented the degradation of these wild-type proteins, but was much less effective in protecting the [E]PROTEIN[/E] mutants",0
"In contrast to substrates of the SKP1-Cullin 1-F box (SCF) complexes, in vitro MODIFICATION of E2F1 by CUL1-ROC1 TRANSFERASE does not require E2F1 phosphorylation, is not stimulated by overexpression of [E]PROTEIN[/E], and is not affected by immunodepletion of SKP1 or mutations in CUL1 disrupting SKPI binding",0
"In contrast to substrates of the SKP1-Cullin 1-F box (SCF) complexes, in vitro MODIFICATION of E2F1 by CUL1-ROC1 TRANSFERASE does not require E2F1 phosphorylation, is not stimulated by overexpression of F box protein SKP2, and is not affected by immunodepletion of SKP1 or mutations in CUL1 disrupting [E]PROTEIN[/E] binding",0
Phosphorylation- and [E]PROTEIN[/E]-independent in vitro MODIFICATION of E2F1 by multiple ROC-cullin TRANSFERASES,0
"In contrast to substrates of the [E]PROTEIN[/E], in vitro MODIFICATION of E2F1 by CUL1-ROC1 TRANSFERASE does not require E2F1 phosphorylation, is not stimulated by overexpression of F box protein SKP2, and is not affected by immunodepletion of SKP1 or mutations in CUL1 disrupting SKPI binding",0
"In contrast to substrates of the SKP1-Cullin 1-F box (SCF) complexes, in vitro MODIFICATION of E2F1 by CUL1-ROC1 TRANSFERASE does not require E2F1 phosphorylation, is not stimulated by overexpression of F box protein SKP2, and is not affected by immunodepletion of [E]PROTEIN[/E] or mutations in CUL1 disrupting SKPI binding",0
"These results suggest a novel, [E]PROTEIN[/E]-independent mechanism for targeting E2F1 MODIFICATION.",0
"In contrast to substrates of the SKP1-Cullin 1-F box (SCF) complexes, in vitro MODIFICATION of E2F1 by CUL1-ROC1 TRANSFERASE does not require E2F1 phosphorylation, is not stimulated by overexpression of F box protein SKP2, and is not affected by immunodepletion of SKP1 or mutations in [E]PROTEIN[/E] disrupting SKPI binding",0
"In contrast to substrates of the SKP1-Cullin 1-F box (SCF) complexes, in vitro MODIFICATION of E2F1 by CUL1-ROC1 TRANSFERASE does not require [E]PROTEIN[/E] phosphorylation, is not stimulated by overexpression of F box protein SKP2, and is not affected by immunodepletion of SKP1 or mutations in CUL1 disrupting SKPI binding",0
[E]PROTEIN[/E] regulates p53 levels under normal and stress conditions by preventing its nuclear export and MODIFICATION,0
"This effect of c-Abl is achieved by preventing the MODIFICATION and nuclear export of p53 by [E]PROTEIN[/E], or by human papillomavirus E6",0
"This effect of [E]PROTEIN[/E] is achieved by preventing the MODIFICATION and nuclear export of p53 by Mdm2, or by human papillomavirus E6",0
The [E]PROTEIN[/E] mediates MODIFICATION of activated atypical protein kinase C,0
These results indicate that [E]PROTEIN[/E] mediated MODIFICATION of p53 contributes to both nuclear export and degradation of p53 but that these activities are not absolutely dependent on each other.,0
"MDM2 promotes p53 nuclear export, and in this study, we show that MODIFICATION of the C terminus of p53 by [E]PROTEIN[/E] contributes to the efficient export of p53 from the nucleus to the cytoplasm",0
"MODIFICATION of Plk1 by [E]PROTEIN[/E] delays the activation of the Cdc25C phosphatase and the inactivation of the Wee1 kinase, leading to a delay in Cdc2 activation",0
[E]PROTEIN[/E] and c-IAP1 mediate MODIFICATION and degradation of TRAF2,0
Here we show that binding of [E]PROTEIN[/E] to TNF-RII induces MODIFICATION and proteasomal degradation of TRAF2,0
Here we show that binding of TNF-alpha to [E]PROTEIN[/E] induces MODIFICATION and proteasomal degradation of TRAF2,0
"Expression of [E]PROTEIN[/E], but not an TRANSFERASE-defective mutant, resulted in TRAF2 MODIFICATION and degradation",0
TNF-RII and [E]PROTEIN[/E] mediate MODIFICATION and degradation of TRAF2,0
The NEDD8 pathway is essential for [E]PROTEIN[/E]-mediated MODIFICATION and processing of the NF-kappa B precursor p105,0
"In a reconstituted cell-free system, MODIFICATION of p105 was stimulated only in the presence of all three components of the NEDD8 pathway, E1, [E]PROTEIN[/E], and NEDD8",0
A Cul-1 mutant that cannot be NEDDylated could not stimulate MODIFICATION and processing of [E]PROTEIN[/E],0
"In a reconstituted cell-free system, MODIFICATION of p105 was stimulated only in the presence of all three components of the [E]PROTEIN[/E] pathway, E1, TRANSFERASE, and NEDD8",0
A [E]PROTEIN[/E] mutant that cannot be NEDDylated could not stimulate MODIFICATION and processing of p105,0
"In a reconstituted cell-free system, MODIFICATION of p105 was stimulated only in the presence of all three components of the NEDD8 pathway, E1, TRANSFERASE, and [E]PROTEIN[/E]",0
"In a reconstituted cell-free system, MODIFICATION of p105 was stimulated only in the presence of all three components of the NEDD8 pathway, [E]PROTEIN[/E], TRANSFERASE, and NEDD8",0
"[E]PROTEIN[/E], but not its RING finger mutant, promoted MODIFICATION of Dlxin-1 in vivo",0
"CHIP promoted the dissociation of Hsp70 from [E]PROTEIN[/E] and Pael-R, thus facilitating Parkin-mediated Pael-R MODIFICATION",0
"[E]PROTEIN[/E] promoted the dissociation of Hsp70 from Parkin and Pael-R, thus facilitating Parkin-mediated Pael-R MODIFICATION",0
"Moreover, [E]PROTEIN[/E] enhanced Parkin-mediated in vitro MODIFICATION of Pael-R in the absence of Hsp70",0
"Moreover, CHIP enhanced [E]PROTEIN[/E]-mediated in vitro MODIFICATION of Pael-R in the absence of Hsp70",0
"CHIP promoted the dissociation of Hsp70 from Parkin and Pael-R, thus facilitating [E]PROTEIN[/E]-mediated Pael-R MODIFICATION",0
"Moreover, CHIP enhanced Parkin-mediated in vitro MODIFICATION of Pael-R in the absence of [E]PROTEIN[/E]",0
"CHIP promoted the dissociation of Hsp70 from Parkin and [E]PROTEIN[/E], thus facilitating Parkin-mediated Pael-R MODIFICATION",0
"CHIP promoted the dissociation of [E]PROTEIN[/E] from Parkin and Pael-R, thus facilitating Parkin-mediated Pael-R MODIFICATION",0
The binding (pull-down and immunoprecipitation assays) and MODIFICATION assays were performed in vitro with purified or partially purified [E]PROTEIN[/E] obtained via expression in bacteria or mammalian cells or by in vitro translation,0
"BACKGROUND: [E]PROTEIN[/E] TRANSFERASE is an enzymatic complex, which mediates MODIFICATION and subsequent proteasome-dependent degradation of phosphorylated inhibitor of NF-kB (IkB) and b-catenin",0
The addition of [E]PROTEIN[/E] to in vitro MODIFICATION assays containing MdmX results in a synergistic increase of GROUP conjugation,0
The addition of Mdm2 to in vitro MODIFICATION assays containing [E]PROTEIN[/E] results in a synergistic increase of GROUP conjugation,0
A negatively charged amino acid in Skp2 is required for [E]PROTEIN[/E] interaction and MODIFICATION of p27Kip1,0
MODIFICATION of p27 requires the [E]PROTEIN[/E] TRANSFERASE and Skp2 F-box binding protein Cks1,0
MODIFICATION of p27 requires the SCFSkp2 TRANSFERASE and Skp2 F-box binding protein [E]PROTEIN[/E],0
Here we show that Asp-331 in the carboxyl terminus of [E]PROTEIN[/E] is required for its association with Cks1 and MODIFICATION of p27,0
Here we show that Asp-331 in the carboxyl terminus of Skp2 is required for its association with [E]PROTEIN[/E] and MODIFICATION of p27,0
Our results revealed a unique requirement for a negatively charged residue in the carboxyl-terminal region of [E]PROTEIN[/E] in recognition of Cks1 and MODIFICATION of p27.,0
Our results revealed a unique requirement for a negatively charged residue in the carboxyl-terminal region of Skp2 in recognition of [E]PROTEIN[/E] and MODIFICATION of p27.,0
A negatively charged amino acid in [E]PROTEIN[/E] is required for Skp2-Cks1 interaction and MODIFICATION of p27Kip1,0
LAF1 MODIFICATION by [E]PROTEIN[/E] controls photomorphogenesis and is stimulated by SPA1,0
"The coiled-coil domain of SPA1, a negative regulator of phyA signalling, has no effect on COP1 autoMODIFICATION but facilitates LAF1 MODIFICATION at low [E]PROTEIN[/E] concentrations",0
"Whereas [E]PROTEIN[/E] mediates efficient MODIFICATION of paxillin in vivo, protein extracts were required for in vitro MODIFICATION, suggesting that additional modifications and/or an associated TRANSFERASE assist RNF5 targeting of paxillin MODIFICATION",0
